{
  "$schema": "https://json-schema.org/draft/2020-12/schema",
  "title": "Web Search proposed provider input (not implemented)",
  "type": "object",
  "properties": {
    "operation": {
      "const": "web"
    },
    "native": {
      "type": "object",
      "properties": {
        "q": {
          "type": "string",
          "minLength": 1,
          "maxLength": 400,
          "description": "Search phrase; nonempty, at most 400 characters and 50 words where required. Place Search also accepts omission or an empty phrase.",
          "x-vendor-constraints": ""
        },
        "country": {
          "type": "string",
          "enum": [
            "AR",
            "AU",
            "AT",
            "BE",
            "BR",
            "CA",
            "CL",
            "DK",
            "FI",
            "FR",
            "DE",
            "GR",
            "HK",
            "IN",
            "ID",
            "IT",
            "JP",
            "KR",
            "MY",
            "MX",
            "NL",
            "NZ",
            "NO",
            "CN",
            "PL",
            "PT",
            "PH",
            "RU",
            "SA",
            "ZA",
            "ES",
            "SE",
            "CH",
            "TW",
            "TR",
            "GB",
            "US",
            "ALL"
          ],
          "default": "US",
          "description": "Result-country selection using the listed country codes; ALL means worldwide. For suggest/spellcheck it is a ranking hint, not a hard geographic boundary.",
          "x-vendor-constraints": "`AR`, `AU`, `AT`, `BE`, `BR`, `CA`, `CL`, `DK`, `FI`, `FR`, `DE`, `GR`, `HK`, `IN`, `ID`, `IT`, `JP`, `KR`, `MY`, `MX`, `NL`, `NZ`, `NO`, `CN`, `PL`, `PT`, `PH`, `RU`, `SA`, `ZA`, `ES`, `SE`, `CH`, `TW`, `TR`, `GB`, `US`, `ALL`; default `US`"
        },
        "search_lang": {
          "type": "string",
          "enum": [
            "ar",
            "eu",
            "bn",
            "bg",
            "ca",
            "zh-hans",
            "zh-hant",
            "hr",
            "cs",
            "da",
            "nl",
            "en",
            "en-gb",
            "et",
            "fi",
            "fr",
            "gl",
            "de",
            "el",
            "gu",
            "he",
            "hi",
            "hu",
            "is",
            "it",
            "ja",
            "jp",
            "kn",
            "ko",
            "lv",
            "lt",
            "ms",
            "ml",
            "mr",
            "nb",
            "pl",
            "pt-br",
            "pt-pt",
            "pa",
            "ro",
            "ru",
            "sr",
            "sk",
            "sl",
            "es",
            "sv",
            "ta",
            "te",
            "th",
            "tr",
            "uk",
            "vi"
          ],
          "default": "en",
          "description": "Preferred content language, not interface language. Codes identify languages; regional/script suffixes narrow the preference.",
          "x-vendor-constraints": "`ar`, `eu`, `bn`, `bg`, `ca`, `zh-hans`, `zh-hant`, `hr`, `cs`, `da`, `nl`, `en`, `en-gb`, `et`, `fi`, `fr`, `gl`, `de`, `el`, `gu`, `he`, `hi`, `hu`, `is`, `it`, `ja`, `jp`, `kn`, `ko`, `lv`, `lt`, `ms`, `ml`, `mr`, `nb`, `pl`, `pt-br`, `pt-pt`, `pa`, `ro`, `ru`, `sr`, `sk`, `sl`, `es`, `sv`, `ta`, `te`, `th`, `tr`, `uk`, `vi`; default `en`"
        },
        "ui_lang": {
          "type": "string",
          "enum": [
            "es-AR",
            "en-AU",
            "de-AT",
            "nl-BE",
            "fr-BE",
            "pt-BR",
            "en-CA",
            "fr-CA",
            "es-CL",
            "da-DK",
            "fi-FI",
            "fr-FR",
            "de-DE",
            "el-GR",
            "zh-HK",
            "en-IN",
            "en-ID",
            "it-IT",
            "ja-JP",
            "ko-KR",
            "en-MY",
            "es-MX",
            "nl-NL",
            "en-NZ",
            "no-NO",
            "zh-CN",
            "pl-PL",
            "en-PH",
            "ru-RU",
            "en-ZA",
            "es-ES",
            "sv-SE",
            "fr-CH",
            "de-CH",
            "zh-TW",
            "tr-TR",
            "en-GB",
            "en-US",
            "es-US"
          ],
          "default": "en-US",
          "description": "Language-region locale for presentation and metadata, not a translation request.",
          "x-vendor-constraints": "`es-AR`, `en-AU`, `de-AT`, `nl-BE`, `fr-BE`, `pt-BR`, `en-CA`, `fr-CA`, `es-CL`, `da-DK`, `fi-FI`, `fr-FR`, `de-DE`, `el-GR`, `zh-HK`, `en-IN`, `en-ID`, `it-IT`, `ja-JP`, `ko-KR`, `en-MY`, `es-MX`, `nl-NL`, `en-NZ`, `no-NO`, `zh-CN`, `pl-PL`, `en-PH`, `ru-RU`, `en-ZA`, `es-ES`, `sv-SE`, `fr-CH`, `de-CH`, `zh-TW`, `tr-TR`, `en-GB`, `en-US`, `es-US`; default `en-US`"
        },
        "count": {
          "type": "integer",
          "minimum": 1.0,
          "maximum": 20.0,
          "default": 20,
          "description": "Requested result ceiling, not a guaranteed number; Web applies it only to web.results, Context uses it for candidate selection.",
          "x-vendor-constraints": "`1`-`20`; default `20`"
        },
        "offset": {
          "type": "integer",
          "minimum": 0.0,
          "maximum": 9.0,
          "default": 0,
          "description": "Zero-based PAGE number, not a row offset. Keep count fixed across pages; duplicate results can occur.",
          "x-vendor-constraints": "`0`-`9`; default `0`"
        },
        "safesearch": {
          "type": "string",
          "enum": [
            "off",
            "moderate",
            "strict"
          ],
          "default": "moderate",
          "description": "Adult-content policy; endpoint-specific off/moderate/strict semantics are explained below.",
          "x-vendor-constraints": "`off`, `moderate`, `strict`; default `moderate`"
        },
        "spellcheck": {
          "type": "boolean",
          "default": true,
          "description": "Allow upstream spelling changes before searching; inspect query.altered rather than pretending the original phrase was executed unchanged.",
          "x-vendor-constraints": "default `true`"
        },
        "freshness": {
          "type": "string",
          "default": "",
          "description": "Page-date filter: pd=24 hours, pw=7 days, pm=31 days, py=365 days, or inclusive-looking start/end syntax YYYY-MM-DDtoYYYY-MM-DD (boundary inclusivity unspecified). Empty means no age filter.",
          "x-vendor-constraints": "default ``"
        },
        "text_decorations": {
          "type": "boolean",
          "default": true,
          "description": "Allow upstream emphasis/highlight markers in display strings. Disable for undecorated snippets; never treat returned markup as trusted HTML.",
          "x-vendor-constraints": "default `true`"
        },
        "result_filter": {
          "type": "string",
          "description": "Comma-separated vertical selector: discussions=forum clusters; faq=question/answer pairs; infobox=entity panels; news=articles; query=query metadata; summarizer=legacy generated-answer key; videos=video cards; web=web links; locations=places. query and type remain present. Availability depends on plan and query.",
          "x-vendor-constraints": "",
          "pattern": "^(discussions|faq|infobox|news|query|summarizer|videos|web|locations)(,(discussions|faq|infobox|news|query|summarizer|videos|web|locations))*$"
        },
        "units": {
          "type": "string",
          "enum": [
            "imperial",
            "metric"
          ],
          "description": "metric uses kilometres/Celsius; imperial uses miles/Fahrenheit. Response quantities carry their own unit fields.",
          "x-vendor-constraints": "`imperial`, `metric`"
        },
        "goggles_id": false,
        "goggles": {
          "oneOf": [
            {
              "type": "string",
              "minLength": 1
            },
            {
              "type": "array",
              "items": {
                "type": "string",
                "minLength": 1
              },
              "minItems": 1,
              "maxItems": 3
            }
          ],
          "description": "One inline ruleset or registered hosted ruleset URL, or up to three such values; changes ranking/filtering rather than searching a different index.",
          "x-vendor-constraints": ""
        },
        "extra_snippets": {
          "type": "boolean",
          "description": "Enable up to five additional alternative excerpts per result; boolean meaning, serialized as true/false in GET despite reference string type."
        },
        "summary": false,
        "enable_rich_callback": {
          "type": "boolean",
          "default": false,
          "description": "Request a rich-result continuation key when the query qualifies. Search plan required; does not automatically perform the second call.",
          "x-vendor-constraints": "default `false`"
        },
        "include_fetch_metadata": {
          "type": "boolean",
          "default": false,
          "description": "Ask for fetch provenance/timestamps; availability and actual freshness are not guaranteed.",
          "x-vendor-constraints": "default `false`"
        },
        "operators": {
          "type": "boolean",
          "default": true,
          "description": "Interpret operator syntax within q when true; false requests literal query treatment. Operator behavior remains experimental.",
          "x-vendor-constraints": "default `true`"
        }
      },
      "additionalProperties": false,
      "required": [
        "q"
      ]
    },
    "localization": {
      "type": "object",
      "properties": {
        "x-loc-lat": {
          "type": "string",
          "description": "User latitude in decimal degrees; a nonsecret, potentially sensitive location hint.",
          "x-vendor-constraints": "`-90`-`90`"
        },
        "x-loc-long": {
          "type": "string",
          "description": "User longitude in decimal degrees; a nonsecret, potentially sensitive location hint.",
          "x-vendor-constraints": "`-180`-`180`"
        },
        "x-loc-timezone": {
          "type": "string",
          "description": "User IANA timezone name; Web only in the fetched references.",
          "x-vendor-constraints": ""
        },
        "x-loc-city": {
          "type": "string",
          "description": "User city name for local ranking.",
          "x-vendor-constraints": ""
        },
        "x-loc-state": {
          "type": "string",
          "description": "First-level region code, at most three characters; ISO 3166-2 subdivision component.",
          "x-vendor-constraints": ""
        },
        "x-loc-state-name": {
          "type": "string",
          "description": "First-level region display name for local ranking.",
          "x-vendor-constraints": ""
        },
        "x-loc-country": {
          "type": "string",
          "enum": [
            "AD",
            "AE",
            "AF",
            "AG",
            "AI",
            "AL",
            "AM",
            "AO",
            "AQ",
            "AR",
            "AS",
            "AT",
            "AU",
            "AW",
            "AX",
            "AZ",
            "BA",
            "BB",
            "BD",
            "BE",
            "BF",
            "BG",
            "BH",
            "BI",
            "BJ",
            "BL",
            "BM",
            "BN",
            "BO",
            "BQ",
            "BR",
            "BS",
            "BT",
            "BV",
            "BW",
            "BY",
            "BZ",
            "CA",
            "CC",
            "CD",
            "CF",
            "CG",
            "CH",
            "CI",
            "CK",
            "CL",
            "CM",
            "CN",
            "CO",
            "CR",
            "CU",
            "CV",
            "CW",
            "CX",
            "CY",
            "CZ",
            "DE",
            "DJ",
            "DK",
            "DM",
            "DO",
            "DZ",
            "EC",
            "EE",
            "EG",
            "EH",
            "ER",
            "ES",
            "ET",
            "FI",
            "FJ",
            "FK",
            "FM",
            "FO",
            "FR",
            "GA",
            "GB",
            "GD",
            "GE",
            "GF",
            "GG",
            "GH",
            "GI",
            "GL",
            "GM",
            "GN",
            "GP",
            "GQ",
            "GR",
            "GS",
            "GT",
            "GU",
            "GW",
            "GY",
            "HK",
            "HM",
            "HN",
            "HR",
            "HT",
            "HU",
            "ID",
            "IE",
            "IL",
            "IM",
            "IN",
            "IO",
            "IQ",
            "IR",
            "IS",
            "IT",
            "JE",
            "JM",
            "JO",
            "JP",
            "KE",
            "KG",
            "KH",
            "KI",
            "KM",
            "KN",
            "KP",
            "KR",
            "KW",
            "KY",
            "KZ",
            "LA",
            "LB",
            "LC",
            "LI",
            "LK",
            "LR",
            "LS",
            "LT",
            "LU",
            "LV",
            "LY",
            "MA",
            "MC",
            "MD",
            "ME",
            "MF",
            "MG",
            "MH",
            "MK",
            "ML",
            "MM",
            "MN",
            "MO",
            "MP",
            "MQ",
            "MR",
            "MS",
            "MT",
            "MU",
            "MV",
            "MW",
            "MX",
            "MY",
            "MZ",
            "NA",
            "NC",
            "NE",
            "NF",
            "NG",
            "NI",
            "NL",
            "NO",
            "NP",
            "NR",
            "NU",
            "NZ",
            "OM",
            "PA",
            "PE",
            "PF",
            "PG",
            "PH",
            "PK",
            "PL",
            "PM",
            "PN",
            "PR",
            "PS",
            "PT",
            "PW",
            "PY",
            "QA",
            "RE",
            "RO",
            "RS",
            "RU",
            "RW",
            "SA",
            "SB",
            "SC",
            "SD",
            "SE",
            "SG",
            "SH",
            "SI",
            "SJ",
            "SK",
            "SL",
            "SM",
            "SN",
            "SO",
            "SR",
            "SS",
            "ST",
            "SV",
            "SX",
            "SY",
            "SZ",
            "TC",
            "TD",
            "TF",
            "TG",
            "TH",
            "TJ",
            "TK",
            "TL",
            "TM",
            "TN",
            "TO",
            "TR",
            "TT",
            "TV",
            "TW",
            "TZ",
            "UA",
            "UG",
            "UM",
            "US",
            "UY",
            "UZ",
            "VA",
            "VC",
            "VE",
            "VG",
            "VI",
            "VN",
            "VU",
            "WF",
            "WS",
            "YE",
            "YT",
            "ZA",
            "ZM",
            "ZW"
          ],
          "description": "User country using the enumerated ISO 3166-1 alpha-2 codes; separate from result-country preference.",
          "x-vendor-constraints": "`AD`, `AE`, `AF`, `AG`, `AI`, `AL`, `AM`, `AO`, `AQ`, `AR`, `AS`, `AT`, `AU`, `AW`, `AX`, `AZ`, `BA`, `BB`, `BD`, `BE`, `BF`, `BG`, `BH`, `BI`, `BJ`, `BL`, `BM`, `BN`, `BO`, `BQ`, `BR`, `BS`, `BT`, `BV`, `BW`, `BY`, `BZ`, `CA`, `CC`, `CD`, `CF`, `CG`, `CH`, `CI`, `CK`, `CL`, `CM`, `CN`, `CO`, `CR`, `CU`, `CV`, `CW`, `CX`, `CY`, `CZ`, `DE`, `DJ`, `DK`, `DM`, `DO`, `DZ`, `EC`, `EE`, `EG`, `EH`, `ER`, `ES`, `ET`, `FI`, `FJ`, `FK`, `FM`, `FO`, `FR`, `GA`, `GB`, `GD`, `GE`, `GF`, `GG`, `GH`, `GI`, `GL`, `GM`, `GN`, `GP`, `GQ`, `GR`, `GS`, `GT`, `GU`, `GW`, `GY`, `HK`, `HM`, `HN`, `HR`, `HT`, `HU`, `ID`, `IE`, `IL`, `IM`, `IN`, `IO`, `IQ`, `IR`, `IS`, `IT`, `JE`, `JM`, `JO`, `JP`, `KE`, `KG`, `KH`, `KI`, `KM`, `KN`, `KP`, `KR`, `KW`, `KY`, `KZ`, `LA`, `LB`, `LC`, `LI`, `LK`, `LR`, `LS`, `LT`, `LU`, `LV`, `LY`, `MA`, `MC`, `MD`, `ME`, `MF`, `MG`, `MH`, `MK`, `ML`, `MM`, `MN`, `MO`, `MP`, `MQ`, `MR`, `MS`, `MT`, `MU`, `MV`, `MW`, `MX`, `MY`, `MZ`, `NA`, `NC`, `NE`, `NF`, `NG`, `NI`, `NL`, `NO`, `NP`, `NR`, `NU`, `NZ`, `OM`, `PA`, `PE`, `PF`, `PG`, `PH`, `PK`, `PL`, `PM`, `PN`, `PR`, `PS`, `PT`, `PW`, `PY`, `QA`, `RE`, `RO`, `RS`, `RU`, `RW`, `SA`, `SB`, `SC`, `SD`, `SE`, `SG`, `SH`, `SI`, `SJ`, `SK`, `SL`, `SM`, `SN`, `SO`, `SR`, `SS`, `ST`, `SV`, `SX`, `SY`, `SZ`, `TC`, `TD`, `TF`, `TG`, `TH`, `TJ`, `TK`, `TL`, `TM`, `TN`, `TO`, `TR`, `TT`, `TV`, `TW`, `TZ`, `UA`, `UG`, `UM`, `US`, `UY`, `UZ`, `VA`, `VC`, `VE`, `VG`, `VI`, `VN`, `VU`, `WF`, `WS`, `YE`, `YT`, `ZA`, `ZM`, `ZW`"
        },
        "x-loc-postal-code": {
          "type": "string",
          "description": "User postal code; do not derive from machine location automatically.",
          "x-vendor-constraints": ""
        }
      },
      "additionalProperties": false
    },
    "output": {
      "type": "object",
      "properties": {
        "mode": {
          "enum": [
            "raw",
            "brief",
            "links",
            "relevant"
          ],
          "default": "brief"
        },
        "max_results": {
          "type": "integer",
          "minimum": 1,
          "maximum": 200,
          "default": 10
        },
        "max_bytes": {
          "type": "integer",
          "minimum": 1024,
          "maximum": 262144,
          "default": 32768
        },
        "fields": {
          "type": "array",
          "maxItems": 32,
          "uniqueItems": true,
          "items": {
            "type": "string",
            "pattern": "^/"
          }
        }
      },
      "additionalProperties": false,
      "allOf": [
        {
          "if": {
            "required": [
              "fields"
            ]
          },
          "then": {
            "required": [
              "mode"
            ],
            "properties": {
              "mode": {
                "const": "raw"
              }
            }
          }
        }
      ]
    }
  },
  "additionalProperties": false,
  "required": [
    "operation",
    "native"
  ]
}
